Stock,Sector,Date,Title,Description,Content,Source,URL,summary
WIPRO.NS,IT,2025-03-15T02:14:49Z,Wipro introduces new global business lines as Pallia sets to complete a year,"Wipro has restructured its business divisions into to better align with client needs, reflecting CEO Srini Pallia's strategy to overhaul the company amid declining revenues and macroeconomic challenges for India's IT industry.","Wipro Ltd has rejigged its global business lines to align with clients needs, reflecting chief executive Srini Pallias efforts towards scripting a turnaround at Indias fourth-largest information tech… [+4545 chars]",Livemint,https://www.livemint.com/companies/news/wipro-changes-global-business-lines-management-exit-srini-pallia-business-overhaul-11742002378785.html,"Wipro has restructured its business divisions into to better align with client needs, reflecting CEO Srini Pallia's strategy to overhaul the company amid declining revenues and macroeconomic challenges for India's IT industry."
ONGC.NS,Energy,2025-03-11T18:55:00Z,"Competition Comm clears ONGC-NTPC Green’s proposal to acquire Ayana for Rs 19,500 cr","NEW DELHI, March 11: The Competition Commission of India on Tuesday cleared ONGC-NTPC Green’s proposal to acquire renewable energy firm Ayana for Rs 19,500 crore (USD 2.3 billion). ONGC-NTPC Green Pvt Ltd (ONGPL), a 50:50 joint venture between ONGC Green (OGL…","NEW DELHI, March 11: The Competition Commission of India on Tuesday cleared ONGC-NTPC Greens proposal to acquire renewable energy firm Ayana for Rs 19,500 crore (USD 2.3 billion).
ONGC-NTPC Green Pv… [+816 chars]",Thehillstimes.in,https://thehillstimes.in/business/competition-comm-clears-ongc-ntpc-greens-proposal-to-acquire-ayana-for-rs-19500-cr,"NEW DELHI, March 11: The Competition Commission of India on Tuesday cleared ONGC-NTPC Green’s proposal to acquire renewable energy firm Ayana for Rs 19,500 crore (USD 2.3 billion). ONGC-NTPC Green Pvt Ltd (ONGPL), a 50:50 joint venture between ONGC Green (OGL…"
ONGC.NS,Energy,2025-03-07T13:44:02Z,Petroleum Minister Hardeep Singh Puri Inaugurates Para Games,The three-day sporting event celebrates the remarkable resilience and achievements of para-athletes from Indias leading Oil & Gas Public Sector Undertakings (PSUs),Minister of Petroleum &amp; Natural Gas Hardeep Singh Puri inaugurated the 6th Oil and Natural Gas Corporation (ONGC) Para Games at Thyagaraj Stadium in New Delhi on Friday. The four-day sporting eve… [+1994 chars],NDTV News,https://sports.ndtv.com/othersports/petroleum-minister-hardeep-singh-puri-inaugurates-para-games-7871441,The three-day sporting event celebrates the remarkable resilience and achievements of para-athletes from Indias leading Oil & Gas Public Sector Undertakings (PSUs)
ONGC.NS,Energy,2025-03-05T07:28:34Z,"Nifty50 appears reasonable, but stock selection is key: Sanjeev Prasad","Sanjeev Prasad discusses the current market, highlighting the lack of substantial value across large-cap, mid-cap, and small-cap indices despite their correction. He points out potential opportunities in the banking sector due to stabilization and growth pros…","""The problem is if a look at Nifty 50 index as an example, it is looking reasonable given the fact that you have a large number of companies in the Nifty 50 index and those companies have a fairly la… [+9830 chars]",The Times of India,https://economictimes.indiatimes.com/markets/expert-view/nifty50-appears-reasonable-but-stock-selection-is-key-sanjeev-prasad/articleshow/118728800.cms,"Sanjeev Prasad discusses the current market, highlighting the lack of substantial value across large-cap, mid-cap, and small-cap indices despite their correction. He points out potential opportunities in the banking sector due to stabilization and growth pros…"
ONGC.NS,Energy,2025-03-05T03:03:14Z,ONGC shares in focus after unit buys clean energy firm PTC Energy for Rs 925 crore,"Oil and Natural Gas Corp's subsidiary, ONGC Green Ltd, has acquired clean energy firm PTC Energy for Rs 925 crore to expand its green energy portfolio. PTC Energy has an operational wind generation capacity of 288.80 MW across Andhra Pradesh, Madhya Pradesh, …","(What's moving Sensex and Nifty Track latest market news, stock tips, Budget 2025, Share Market on Budget 2025 and expert advice, on ETMarkets. Also, ETMarkets.com is now on Telegram. For fastest new… [+330 chars]",The Times of India,https://economictimes.indiatimes.com/markets/stocks/news/ongc-shares-in-focus-after-unit-buys-clean-energy-firm-ptc-energy-for-rs-925-crore/articleshow/118722584.cms,"Oil and Natural Gas Corp's subsidiary, ONGC Green Ltd, has acquired clean energy firm PTC Energy for Rs 925 crore to expand its green energy portfolio. PTC Energy has an operational wind generation capacity of 288.80 MW across Andhra Pradesh, Madhya Pradesh, …"
ONGC.NS,Energy,2025-03-10T02:48:38Z,"ONGC shares in focus after petrochemical arm exits from Dahej SEZ, eyes local market","Shares of ONGC will be in focus after its subsidiary OPaL shifts from export focus to the domestic market by exiting SEZ status. Effective from March 8, 2025, OPaL aims to boost profit margins by operating as a Domestic Tariff Area unit, enabling it to levera…","Shares of ONGC will be in focus on Monday after its subsidiary ONGC PetroAdditions Ltd (OPaL) decided to relinquish its ""only-for-export"" status and shift its focus to the rapidly expanding domestic … [+2381 chars]",The Times of India,https://economictimes.indiatimes.com/markets/stocks/news/ongc-shares-in-focus-after-petrochemical-arm-exits-from-dahej-sez-eyes-local-market/articleshow/118828690.cms,"Shares of ONGC will be in focus after its subsidiary OPaL shifts from export focus to the domestic market by exiting SEZ status. Effective from March 8, 2025, OPaL aims to boost profit margins by operating as a Domestic Tariff Area unit, enabling it to levera…"
ONGC.NS,Energy,2025-03-25T09:17:16Z,India’s Top Oil and Gas Explorer Prepares for a Looming Glut,"India’s largest explorer Oil and Natural Gas Corp. is seeking to diversify its portfolio to shield its core business from volatile oil prices, said Arunangshu Sarkar, director for strategy at the state-run giant.","(Bloomberg) Indias largest explorer Oil and Natural Gas Corp. is seeking to diversify its portfolio to shield its core business from volatile oil prices, said Arunangshu Sarkar, director for strategy… [+2209 chars]",Financial Post,https://financialpost.com/pmn/business-pmn/indias-top-oil-and-gas-explorer-prepares-for-a-looming-glut,"India’s largest explorer Oil and Natural Gas Corp. is seeking to diversify its portfolio to shield its core business from volatile oil prices, said Arunangshu Sarkar, director for strategy at the state-run giant."
ONGC.NS,Energy,2025-03-08T00:00:15Z,"HPCL gets new chief, four more large PSUs in queue","The appointments to the position of chairman and managing director (CMD) at these energy giants, most of which are Maharatna central public sector enterprises (CPSEs), will have a significant bearing on India’ energy security, given the strategic role played …","New Delhi: The process of appointing new honchos for five large state-owned enterprises with combined revenue of more than 18 trillion found its first appointee on Thursday.
Vikas Kaushal, a partner… [+7908 chars]",Livemint,https://www.livemint.com/industry/new-chiefs-at-ongc-ntpc-bpcl-hpcl-and-nhpc-appointment-petrobras-energy-security-hydrocarbon-kearney-s-india-11741260545960.html,"The appointments to the position of chairman and managing director (CMD) at these energy giants, most of which are Maharatna central public sector enterprises (CPSEs), will have a significant bearing on India’ energy security, given the strategic role played …"
ONGC.NS,Energy,2025-03-21T10:21:00Z,"Jadavpur University Alumni Association, Mumbai to Host 16th National Conference on March 22, 2025","The conference titled 'India @2030: Energy, Economy, Employment' explores key issues affecting India's future development LTIMindtree CEO Debashis Chatterjee to be the Chief Guest; ONGC Director of Production Pankaj Kumar to deliver Keynote Address Speakers i…","LTIMindtree CEO and Managing Director Debashis Chatterjee, an alumnus of Jadavpur University and one of India's leading IT leaders, will be the Chief Guest at the Conference. Oil and Gas Industry vet… [+4017 chars]",PR Newswire UK,https://www.prnewswire.co.uk/news-releases/jadavpur-university-alumni-association-mumbai-to-host-16th-national-conference-on-march-22-2025-302407902.html,"The conference titled 'India @2030: Energy, Economy, Employment' explores key issues affecting India's future development LTIMindtree CEO Debashis Chatterjee to be the Chief Guest; ONGC Director of Production Pankaj Kumar to deliver Keynote Address Speakers i…"
ONGC.NS,Energy,2025-03-05T09:38:36Z,Crude oil price falls to $70 per barrel. Emkay likes these stocks,"The OPEC+ decision to reintroduce 2.2 million barrels per day (mbpd) of oil over the next two years was ""cautiously expected,"" yet still notable, as it represents 38% of the 5.9 mbpd in cumulative cuts made since 2022, according to the brokerage.","Brent prices have slipped to $70 per barrel as OPEC+ moves to gradually unwind its voluntary production cuts, but Emkay Global Financial Services believes this level remains favourable for Indias oil… [+3915 chars]",The Times of India,https://economictimes.indiatimes.com/markets/commodities/news/crude-oil-price-falls-to-70-per-barrel-emkay-likes-these-stocks/articleshow/118731965.cms,"The OPEC+ decision to reintroduce 2.2 million barrels per day (mbpd) of oil over the next two years was ""cautiously expected,"" yet still notable, as it represents 38% of the 5.9 mbpd in cumulative cuts made since 2022, according to the brokerage."
ONGC.NS,Energy,2025-03-26T01:00:00Z,"Stock to buy today: Grasim Industries (₹2,571.55) – BUY","Stocks to buy today, 26 March 2025: Buy  Grasim Industries & The share price can rise to ₹2,750-2,800","The short-term outlook is bullish for Grasim Industries. The stock rose over 2 per cent on Tuesday, breaking above the key resistance levels of 2,530 and 2,550. This confirms a double-bottom pattern … [+866 chars]",BusinessLine,https://www.thehindubusinessline.com/portfolio/technical-analysis/stock-to-buy-today-grasim-industries-257155-buy/article69373042.ece,"Stocks to buy today, 26 March 2025: Buy  Grasim Industries & The share price can rise to ₹2,750-2,800"
ONGC.NS,Energy,2025-02-27T09:34:55Z,"India exploring critical minerals in Zambia, Congo and Australia: Mines Secretary","India is taking efforts to reduce its reliance on imports of minerals such as lithium, key to energy transition technologies.","India is exploring mining of critical minerals in Zambia, Congo and Australia, Mines Secretary V.L. Kantha Rao said on Thursday, as the world's fastest-growing major economy aims to secure raw materi… [+1395 chars]",BusinessLine,https://www.thehindubusinessline.com/economy/india-exploring-critical-minerals-in-zambia-congo-and-australia-mines-secretary/article69269736.ece,"India is taking efforts to reduce its reliance on imports of minerals such as lithium, key to energy transition technologies."
ONGC.NS,Energy,2025-02-28T07:55:44Z,2 top stock recommendations from Sneha Seth,"Nifty has support around 22,200 and banking index support is near 47,800. The market shows significant corrections with FIIs lacking buying interest. Coal India and ONGC are suggested buys, while IndusInd Bank is recommended for selling. Overall, caution and …","""As far as supports are concerned for Nifty, I believe there is a support around 22,200 followed by 22,000 which is the support zone for Nifty,"" says Sneha Seth, Angel One.It is just a deep sea of re… [+3991 chars]",The Times of India,https://economictimes.indiatimes.com/markets/expert-view/2-top-stock-recommendations-from-sneha-seth/articleshow/118622658.cms,"Nifty has support around 22,200 and banking index support is near 47,800. The market shows significant corrections with FIIs lacking buying interest. Coal India and ONGC are suggested buys, while IndusInd Bank is recommended for selling. Overall, caution and …"
ONGC.NS,Energy,2025-03-15T08:30:39Z,"Andhra Man Kills Sons For 'Poor Academic Performance', Dies By Suicide","A 37-year-old ONGC employee has allegedly killed his two minor sons for &quot;poor academic performance&quot; and died by suicide in Andhra Pradesh&#039;s Kakinada, a police official said on Saturday.","Kakinada (Andhra Pradesh): A 37-year-old ONGC employee has allegedly killed his two minor sons for ""poor academic performance"" and died by suicide in this district, a police official said on Saturday… [+967 chars]",NDTV News,https://www.ndtv.com/andhra-pradesh-news/ongc-employee-kills-sons-for-poor-academic-performance-dies-by-suicide-7928458,"A 37-year-old ONGC employee has allegedly killed his two minor sons for &quot;poor academic performance&quot; and died by suicide in Andhra Pradesh&#039;s Kakinada, a police official said on Saturday."
ONGC.NS,Energy,2025-03-13T04:29:06Z,Stock market update: Stocks that hit 52-week lows on NSE,"IndusInd Bank,  Shriram Finance,  Apollo Hospital,  Bajaj Auto and  Hero MotoCorp were among the top losers on NSE.","NEW DELHI: SVP Global, AGS Transact Tech, Rolta India, Nectar Lifesc and Kesoram Inds. and others were among the stocks that touched their 52-week lows as of 09:59AM(IST)in Thursday's session. Domest… [+493 chars]",The Times of India,https://economictimes.indiatimes.com/markets/stocks/stock-watch/stock-market-update-stocks-that-hit-52-week-lows-on-nse/articleshow/118960868.cms,"IndusInd Bank,  Shriram Finance,  Apollo Hospital,  Bajaj Auto and  Hero MotoCorp were among the top losers on NSE."
ONGC.NS,Energy,2025-03-21T10:45:30Z,Sensex rises! These stocks surged over 5% on BSE,The BSE Sensex closed 557.45  up  at 76905.51 on Friday.,"NEW DELHI: A number of stocks surged as much as 5% or more in Friday's trade as Dalal Street closed higher for the day. Equity benchmark Sensex ended the session up 557.45 points at 76905.51. 
The t… [+710 chars]",The Times of India,https://economictimes.indiatimes.com/markets/stocks/stock-watch/sensex-rises-these-stocks-surged-over-5-on-bse/articleshow/119299925.cms,The BSE Sensex closed 557.45  up  at 76905.51 on Friday.
ONGC.NS,Energy,2025-03-09T09:04:18Z,"ONGC's OPaL exits from Dahej SEZ, eyes local market","ONGC's OPaL exits from Dahej SEZ, eyes local market","New Delhi, ONGC PetroAdditions Ltd, a subsidiary of the state-owned Oil and Natural Gas Corporation , has relinquished its 'only-for-export' unit status as it aims to tap into the booming local petro… [+2894 chars]",Livemint,https://www.livemint.com/companies/news/ongcs-opal-exits-from-dahej-sez-eyes-local-market-11741511058506.html,"ONGC's OPaL exits from Dahej SEZ, eyes local market"
ONGC.NS,Energy,2025-03-19T11:37:46Z,7 Lucrative Career Paths After Cracking GATE Exam,"The GATE 2025 results, announced on March 19, have opened up diverse career paths for engineering graduates. From advanced studies in top IITs and NITs to securing positions in reputed public sector undertakings like ONGC, NTPC, IOCL, and BHEL, GATE qualifier…",How to prevent plants from dying and wilting in summers,The Times of India,https://timesofindia.indiatimes.com/education/news/7-lucrative-career-paths-after-cracking-gate-exam/articleshow/119210515.cms,"The GATE 2025 results, announced on March 19, have opened up diverse career paths for engineering graduates. From advanced studies in top IITs and NITs to securing positions in reputed public sector undertakings like ONGC, NTPC, IOCL, and BHEL, GATE qualifier…"
ONGC.NS,Energy,2025-03-07T10:06:26Z,Union Minister Puri asks PSUs to boost initiatives to promote sports for para-athletes,"Union Minister Hardeep Singh Puri urged oil PSUs to enhance support for para-athletes. While inaugurating the 6th ONGC Para Games, he highlighted the achievements of Indian para-athletes on international platforms and emphasized the government's focus on prom…","Artificial Intelligence(AI)
AI and Analytics based Business Strategy
By - Tanusree De, Managing Director- Accenture Technology Lead, Trustworthy AI Center of Excellence: ATCI
View Program",The Times of India,https://economictimes.indiatimes.com/news/sports/union-minister-puri-asks-psus-to-boost-initiatives-to-promote-sports-for-para-athletes/articleshow/118783946.cms,"Union Minister Hardeep Singh Puri urged oil PSUs to enhance support for para-athletes. While inaugurating the 6th ONGC Para Games, he highlighted the achievements of Indian para-athletes on international platforms and emphasized the government's focus on prom…"
ONGC.NS,Energy,2025-03-20T09:23:57Z,Several IPO-bound cos may have to refile offer docs: Emkay Global Financial Services,"Year over year, the IPOs in Jan-Feb 2025 is limited to only 10 versus 15 last year, whereas QIPs in Jan-Mar 2025 is limited to only 7 versus 18 last year","The correction in the equity market has started showing its impact on fund raising activities. CY24 saw 92 IPOs, raising over 1,62,261 crores, whereas companies raised over 1,36,424 crores via 91 QIP… [+1757 chars]",BusinessLine,https://www.thehindubusinessline.com/markets/several-ipo-bound-cos-may-have-to-refile-offer-docs-emkay-global-financial-services/article69352541.ece,"Year over year, the IPOs in Jan-Feb 2025 is limited to only 10 versus 15 last year, whereas QIPs in Jan-Mar 2025 is limited to only 7 versus 18 last year"
ONGC.NS,Energy,2025-03-14T13:31:31Z,"ONGC disregarding safety norms, endangering human lives: Human Rights Forum in Andhra","HRF accuses oil and gas companies, including ONGC, of negligence and poor safety protocols following a Hydrogen Sulphide leak in Andhra Pradesh. The leak affected several workers and a child, citing inadequate maintenance and weak regulatory enforcement. HRF …",The Andhra Pradesh Human Rights Forum (HRF) on Friday accused oil and gas companies of neglecting safety protocols and putting people's lives at risk. It cited the recent gas leak at the ONGC facilit… [+2512 chars],The Times of India,https://economictimes.indiatimes.com/industry/energy/oil-gas/ongc-disregarding-safety-norms-endangering-human-lives-human-rights-forum-in-andhra/articleshow/119014940.cms,"HRF accuses oil and gas companies, including ONGC, of negligence and poor safety protocols following a Hydrogen Sulphide leak in Andhra Pradesh. The leak affected several workers and a child, citing inadequate maintenance and weak regulatory enforcement. HRF …"
ONGC.NS,Energy,2025-03-04T05:19:24Z,IRFC shares rally 4% after securing Navratna status from Indian government,"IRFC share price: The Department of Public Enterprises announced on Monday that IRFC and Indian Railway Catering and Tourism Corporation (IRCTC) have been granted Navratna status, bringing the total number of such Central Public Sector Enterprises (CPSEs) to …","Shares of Indian Railway Finance Corporation (IRFC) surged as much as 3.7% on Tuesday to Rs 115.25 on the BSE after the Government of India granted the company a Navratna status, enhancing its financ… [+1787 chars]",The Times of India,https://economictimes.indiatimes.com/markets/stocks/news/irfc-shares-rally-4-after-securing-navratna-status-from-indian-government/articleshow/118699379.cms,"IRFC share price: The Department of Public Enterprises announced on Monday that IRFC and Indian Railway Catering and Tourism Corporation (IRCTC) have been granted Navratna status, bringing the total number of such Central Public Sector Enterprises (CPSEs) to …"
ONGC.NS,Energy,2025-03-05T07:06:29Z,ONGC continues to expand green energy portfolio; adds wind power assets,"In a BSE filing late Tuesday night, the exploration and production (E&P) major said its subsidiary ONGC Green (OGL) has acquired PEL, a subsidiary of power trader PTC India","State-run ONGC has acquired wind power generator PTC Energy (PEL) for 925 crore marking its third exercise in the current calendar year to expand green energy business, part of the E&amp;P majors str… [+2545 chars]",BusinessLine,https://www.thehindubusinessline.com/companies/ongc-continues-to-expand-green-energy-portfolio-adds-wind-power-assets/article69293154.ece,"In a BSE filing late Tuesday night, the exploration and production (E&P) major said its subsidiary ONGC Green (OGL) has acquired PEL, a subsidiary of power trader PTC India"
ONGC.NS,Energy,2025-03-15T08:53:37Z,"ONGC employee kills his two minor sons, later dies by suicide","An ONGC employee named V Chandra Kishore allegedly drowned his two minor sons in a bucket and later died by suicide in Kakinada, Andhra Pradesh. Dissatisfied with their academic performance, he feared they would struggle in a competitive world. The police rec…","An ONGC employee aged 37 years allegedly killed his two minor sons for ""poor academic performance"" and later died by suicide in Andhra Pradesh's Kakinada, a police official told PTI on Saturday. The … [+831 chars]",The Times of India,https://economictimes.indiatimes.com/news/india/ongc-employee-kills-his-two-minor-sons-later-dies-by-suicide/articleshow/119039031.cms,"An ONGC employee named V Chandra Kishore allegedly drowned his two minor sons in a bucket and later died by suicide in Kakinada, Andhra Pradesh. Dissatisfied with their academic performance, he feared they would struggle in a competitive world. The police rec…"
ONGC.NS,Energy,2025-03-20T06:08:50Z,PTC India divests stake in PTC Energy to ONGC Green,"PTC India has completed the divestment of its entire stake in PTC Energy to ONGC Green Ltd (OGL), receiving the remaining Rs 254 crore. The total transaction amount was Rs 1,179 crore, with Rs 925 crore previously received on March 4, 2025. PTC India shares m…",PTC India on Thursday said it has divested its entire stake in PTC Energy to ONGC Green after receiving the remaining Rs 254 crore as part of the deal. Upon receipt of the total consideration of Rs 1… [+627 chars],The Times of India,https://economictimes.indiatimes.com/industry/energy/power/ptc-india-divests-stake-in-ptc-energy-to-ongc-green/articleshow/119243354.cms,"PTC India has completed the divestment of its entire stake in PTC Energy to ONGC Green Ltd (OGL), receiving the remaining Rs 254 crore. The total transaction amount was Rs 1,179 crore, with Rs 925 crore previously received on March 4, 2025. PTC India shares m…"
ONGC.NS,Energy,2025-03-22T15:45:45Z,Movers & Shakers: Stocks that will see action this week,"Stock analysis and recommendations for HDFC Bank Ltd, NMDC  Ltd and ONGC with potential price targets and stop-loss levels.","HDFC Bank (1,769.85)
Breaks out of a resistance
HDFC Banks stock has largely been moving in a sideways trend since early February. It has been oscillating between 1,670 and 1,740. Last week, it sur… [+1931 chars]",BusinessLine,https://www.thehindubusinessline.com/portfolio/technical-analysis/movers-shakers-stocks-that-will-see-action-this-week/article69362178.ece,"Stock analysis and recommendations for HDFC Bank Ltd, NMDC  Ltd and ONGC with potential price targets and stop-loss levels."
ONGC.NS,Energy,2025-03-12T17:38:32Z,Ongoing oil sector reforms attracted $17bn investment in 2024 – NNPCL,"The Nigerian National Petroleum Company Limited has revealed that reforms in the oil and gas sector, driven by the enactment of the Petroleum Industry Act 2021 and Executive Orders issued by President Bola Tinubu, attracted about $17bn in foreign investment i…","The Nigerian National Petroleum Company Limited has revealed that reforms in the oil and gas sector, driven by the enactment of the Petroleum Industry Act 2021 and Executive Orders issued by Presiden… [+3263 chars]",The Punch,https://punchng.com/ongoing-reforms-in-oil-sector-attracted-17bn-investment-in-2024-nnpcl/,"The Nigerian National Petroleum Company Limited has revealed that reforms in the oil and gas sector, driven by the enactment of the Petroleum Industry Act 2021 and Executive Orders issued by President Bola Tinubu, attracted about $17bn in foreign investment i…"
ONGC.NS,Energy,2025-03-11T16:04:35Z,CCI approves ONGC-NTPC Green’s 100% acquisition of Ayana Renewable Power,"This transaction signals a strategic consolidation in India’s green energy sector, aligning with the nation’s long-term sustainability goals","In a significant move that underscores Indias commitment to renewable energy expansion, the Competition Commission of India (CCI) has approved the acquisition of Ayana Renewable Power Private Ltd by … [+2475 chars]",BusinessLine,https://www.thehindubusinessline.com/companies/cci-approves-ongc-ntpc-greens-100-acquisition-of-ayana-renewable-power/article69317909.ece,"This transaction signals a strategic consolidation in India’s green energy sector, aligning with the nation’s long-term sustainability goals"
ONGC.NS,Energy,2025-03-04T16:02:58Z,PESB invites applications for selection of ONGC CMD,"PESB invites applications for ONGC Chairman post; MoPNG to route CPSE MD applications; deadline April 11, 2025.",The Public Enterprises Selection Board (PESB) on Monday invited applications from qualified candidates for the post of Chairman of the oil and gas exploration &amp; production (E&amp;P) major ONGC wi… [+1046 chars],BusinessLine,https://www.thehindubusinessline.com/companies/pesb-invites-applications-for-selection-of-ongc-cmd/article69291109.ece,"PESB invites applications for ONGC Chairman post; MoPNG to route CPSE MD applications; deadline April 11, 2025."
