Stock,Sector,Date,Title,Description,Content,Source,URL,summary
RELIANCE.NS,Energy,2025-03-26T10:57:01Z,College students using AI are worried their skills could stagnate. Some feel guilty about heavy use.,Conversations with over a dozen college students across the US revealed fears of developing an over-reliance on AI.,"College students told BI they worried about the effects of relying on AI for coursework, but leaned on the technology to lighten their workload.ljubaphoto/Getty Images
<ul><li>BI talked to more than… [+9050 chars]",Business Insider,https://www.businessinsider.com/how-college-students-use-ai-homework-study-2025-3,Conversations with over a dozen college students across the US revealed fears of developing an over-reliance on AI.
RELIANCE.NS,Energy,2025-03-12T10:03:27Z,India's richest man is giving Elon Musk's Starlink a big boost,"Ambani's Jio Platforms announced that it would bring Starlink into India, opening doors to the world's largest consumer market.","Mukesh Ambani announced a partnership with Elon Musk's SpaceX.SUJIT JAISWAL/AFP via Getty Images, Associated Press
<ul><li>India's richest man, Mukesh Ambani, announced a partnership with Elon Musk'… [+3312 chars]",Business Insider,https://www.businessinsider.com/india-richest-man-mukesh-ambani-elon-musk-starlink-big-boost-2025-3,"Ambani's Jio Platforms announced that it would bring Starlink into India, opening doors to the world's largest consumer market."
RELIANCE.NS,Energy,2025-03-12T02:58:24Z,India's Reliance joins with Musk's Starlink in surprise move,,"If you click 'Accept all', we and our partners, including 238 who are part of the IAB Transparency &amp; Consent Framework, will also store and/or access information on a device (in other words, use … [+702 chars]",Yahoo Entertainment,https://consent.yahoo.com/v2/collectConsent?sessionId=1_cc-session_d15d8996-89aa-48d8-8b6c-8d0ecfcfc7ce,"""Consumers who click 'Accept all' on websites grant permission for 238 IAB Framework partners—and potentially hundreds more—to store and access their device data for tracking and advertising purposes. This practice highlights ongoing privacy concerns as companies expand data collection under consent agreements."""
RELIANCE.NS,Energy,2025-03-18T21:20:00Z,Dutch Parliament Calls For End To Dependence On US Software Companies,The Dutch parliament approved motions urging the government to reduce reliance on U.S. software companies by developing a sovereign cloud platform and reconsidering contracts with American firms. Reuters reports: While such initiatives have foundered in the p…,"While such initiatives have foundered in the past due to a lack of viable European alternatives, lawmakers said changing relations with the United States under the presidency of Donald Trump have giv… [+1050 chars]",Slashdot.org,https://yro.slashdot.org/story/25/03/18/209246/dutch-parliament-calls-for-end-to-dependence-on-us-software-companies,The Dutch parliament approved motions urging the government to reduce reliance on U.S. software companies by developing a sovereign cloud platform and reconsidering contracts with American firms. Reuters reports: While such initiatives have foundered in the p…
RELIANCE.NS,Energy,2025-03-26T13:35:00Z,Shackles Found in Egyptian Gold Mine Reveal the Human Toll of Ancient Wealth,The artifacts reveal the harsh working conditions in ancient Egyptian gold mines under the rule of the Ptolemaic dynasty.,"In the second century BCE, Greek historian and geographer Agatharchides wrote about the severe working conditions of the criminals and prisoners of war who toiled in ancient Egyptian gold mines: And … [+3437 chars]",Gizmodo.com,https://gizmodo.com/shackles-found-in-egyptian-gold-mine-reveal-the-human-toll-of-ancient-wealth-2000580667,The artifacts reveal the harsh working conditions in ancient Egyptian gold mines under the rule of the Ptolemaic dynasty.
RELIANCE.NS,Energy,2025-03-11T17:00:59Z,Meta Is Ready to Rock Nvidia’s Boat With Its In-House AI Chip,"Gradually, then suddenly, the big tech companies are replacing Nvidia's pricey AI chips.","The adage goes, “your arbitrage is my opportunity,” and could be used to sum up Meta’s push into building an in-house chip for AI training tasks. Reutersreports the company recently began a small dep… [+3250 chars]",Gizmodo.com,https://gizmodo.com/meta-is-ready-to-rock-nvidias-boat-with-its-in-house-ai-chip-2000574428,"Gradually, then suddenly, the big tech companies are replacing Nvidia's pricey AI chips."
RELIANCE.NS,Energy,2025-03-26T09:42:02Z,Trump adviser Mike Waltz takes 'full responsibility' for Signal group chat leak,But the US national security adviser said he could not explain how a journalist was added to a chat discussing air strikes in Yemen.,US National Security Adviser Mike Waltz has taken responsibility for a group chat in which high-ranking officials planned military strikes in Yemen in the company of a journalist who was inadvertentl… [+3833 chars],BBC News,https://www.bbc.com/news/articles/cvg12ewv7xyo,But the US national security adviser said he could not explain how a journalist was added to a chat discussing air strikes in Yemen.
RELIANCE.NS,Energy,2025-03-11T15:12:14Z,QuickBooks Adds Support for Tap to Pay on iPhone,"Intuit QuickBooks today announced Tap to Pay on iPhone for QuickBooks Online customers in the United States, allowing small and mid-market businesses to accept in-person contactless payments without additional hardware.





The feature integrates with the Qu…","Intuit QuickBooks today announced Tap to Pay on iPhone for QuickBooks Online customers in the United States, allowing small and mid-market businesses to accept in-person contactless payments without … [+947 chars]",MacRumors,https://www.macrumors.com/2025/03/11/quickbooks-adds-tap-to-pay-on-iphone/,"Intuit QuickBooks today announced Tap to Pay on iPhone for QuickBooks Online customers in the United States, allowing small and mid-market businesses to accept in-person contactless payments without additional hardware.





The feature integrates with the Qu…"
RELIANCE.NS,Energy,2025-03-18T00:44:56Z,All Four iPhone 17 Models Again Rumored to Feature Apple-Designed Wi-Fi 7 Chip,"All four iPhone 17 models will feature an Apple-designed Wi-Fi 7 chip, according to Jeff Pu, an analyst who covers companies within Apple's supply chain.





In a research note with investment firm GF Securities today, Pu said he believes that the Wi-Fi 7 ch…","All four iPhone 17 models will feature an Apple-designed Wi-Fi 7 chip, according to Jeff Pu, an analyst who covers companies within Apple's supply chain.
In a research note with investment firm GF S… [+1255 chars]",MacRumors,https://www.macrumors.com/2025/03/17/iphone-17-series-apple-wifi-7-chip/,"All four iPhone 17 models will feature an Apple-designed Wi-Fi 7 chip, according to Jeff Pu, an analyst who covers companies within Apple's supply chain.





In a research note with investment firm GF Securities today, Pu said he believes that the Wi-Fi 7 ch…"
RELIANCE.NS,Energy,2025-03-23T11:40:00Z,Solar-Powered Transportation & The Eco-Friendly Revolution Taking Over,"Solar-Powered Transportation & The Eco-Friendly Revolution Taking OverSolar energy is increasingly being utilized in the future of transportation to promote sustainable mobility, reducing reliance on non-renewable fossil fuels while meeting energy demands....","Solar energy is increasingly being utilized in the future of transportation to promote sustainable mobility, reducing reliance on non-renewable fossil fuels while meeting energy demands. It is alread… [+10809 chars]",Yanko Design,https://www.yankodesign.com/2025/03/23/solar-powered-transportation-the-eco-friendly-revolution-taking-over/,"Solar-Powered Transportation & The Eco-Friendly Revolution Taking OverSolar energy is increasingly being utilized in the future of transportation to promote sustainable mobility, reducing reliance on non-renewable fossil fuels while meeting energy demands...."
RELIANCE.NS,Energy,2025-03-19T18:10:38Z,Elon Musk Is Joining Microsoft in $30 Billion Data Center Project,"The biggest backer of OpenAI, Microsoft is now building its own AI models and teaming up with Sam Altman's mortal enemy.","Elon Musk somehow manages to win again. Microsoft, along with BlackRock and UAE-based MGX, have announced they are partnering with his artificial intelligence startup xAI on a $30 billion project to … [+5542 chars]",Gizmodo.com,https://gizmodo.com/elon-musk-is-joining-microsoft-in-30-billion-data-center-project-2000578097,"The biggest backer of OpenAI, Microsoft is now building its own AI models and teaming up with Sam Altman's mortal enemy."
RELIANCE.NS,Energy,2025-03-23T03:45:01Z,Sources: OpenAI has spoken with Reliance about a potential product and sales partnership in India; Meta also plans to work with Reliance on new AI businesses (The Information),"The Information:
Sources: OpenAI has spoken with Reliance about a potential product and sales partnership in India; Meta also plans to work with Reliance on new AI businesses  —  OpenAI executives in recent months have spoken multiple times with their counter…","About This Page
This is a Techmeme archive page.
It shows how the site appeared at 11:45 PM ET, March 22, 2025.
The most current version of the site as always is available at our home page.
To vi… [+69 chars]",Techmeme.com,https://www.techmeme.com/250322/p22,"The Information:
Sources: OpenAI has spoken with Reliance about a potential product and sales partnership in India; Meta also plans to work with Reliance on new AI businesses  —  OpenAI executives in recent months have spoken multiple times with their counter…"
RELIANCE.NS,Energy,2025-03-03T00:30:37Z,India's top telco plans cloud PCs for its 475 million subscribers,"PLUS: China bans AI leaders from visiting USA; Acer data leak suspect cuffed; and more
Asia In Brief India’s top telco Reliance Jio , which boasts over 460 million subscribers, will soon introduce a cloud PC.…<!--#include virtual='/data_centre/_whitepaper_tex…","Asia In Brief Indias top telco Reliance Jio , which boasts over 460 million subscribers, will soon introduce a cloud PC.
Company chair Akash M Ambani on Saturday revealed the plan at Mumbai Tech Wee… [+4359 chars]",Theregister.com,https://www.theregister.com/2025/03/03/asia_tech_news_in_brief/,"PLUS: China bans AI leaders from visiting USA; Acer data leak suspect cuffed; and more
Asia In Brief India’s top telco Reliance Jio , which boasts over 460 million subscribers, will soon introduce a cloud PC.…<!--#include virtual='/data_centre/_whitepaper_tex…"
RELIANCE.NS,Energy,2025-03-17T14:33:13Z,Euro techies call for sovereign fund to escape Uncle Sam's digital death grip,"Nearly 100 orgs plead for homegrown lifeline amid geopolitical tensions
A group of technology companies and lobbyists want the European Commission (EC) to take action to reduce the region's reliance on foreign-owned digital services and infrastructure.…","A group of technology companies and lobbyists want the European Commission (EC) to take action to reduce the region's reliance on foreign-owned digital services and infrastructure.
In an open letter… [+3280 chars]",Theregister.com,https://www.theregister.com/2025/03/17/european_tech_sovereign_fund/,"Nearly 100 orgs plead for homegrown lifeline amid geopolitical tensions
A group of technology companies and lobbyists want the European Commission (EC) to take action to reduce the region's reliance on foreign-owned digital services and infrastructure.…"
RELIANCE.NS,Energy,2025-03-17T00:06:04Z,Grangemouth: A new dawn for the home of UK's oldest oil refinery?,Its history was built on fossil fuels - but now the site's future depends on its reinvention as a green energy industrial hub.,"Kevin KeaneBBC Scotland's environment correspondent
There is both concern and optimism about the Grangemouth site's long-term future
The history of Grangemouth has been built on fossil fuels but no… [+5388 chars]",BBC News,https://www.bbc.com/news/articles/c62x6l5g36lo,Its history was built on fossil fuels - but now the site's future depends on its reinvention as a green energy industrial hub.
RELIANCE.NS,Energy,2025-03-01T08:19:11Z,The cost of Go's panic and recover,"TL;DR ¶ Some of the wisdom contained in Josh Bloch’s Effective Java book is relevant to Go. panic and recover are best reserved for exceptional circumstances. Reliance on panic and recover can noticeably slow down execution, incurs heap allocations, and precl…","TL;DR ¶
<ul><li>Some of the wisdom contained in Josh Bloch’s Effective Java book is
relevant to Go.</li><li>panic and recover are best reserved for exceptional circumstances.</li><li>Reliance on pa… [+14972 chars]",Jub0bs.com,https://jub0bs.com/posts/2025-02-28-cost-of-panic-recover/,"TL;DR ¶ Some of the wisdom contained in Josh Bloch’s Effective Java book is relevant to Go. panic and recover are best reserved for exceptional circumstances. Reliance on panic and recover can noticeably slow down execution, incurs heap allocations, and precl…"
RELIANCE.NS,Energy,2025-03-04T19:05:28Z,Rumors claim Samsung is 'urgent' about an Exynos 2600 push for the Galaxy S26,In-house chip rumors continue to surface as Samsung looks to get back into form.,"What you need to know
<ul><li>Rumors suggest Samsung is kicking up the ""urgency"" concerning its next in-house SoC, the Exynos 2600.</li><li>The company supposedly created a ""task force"" to oversee t… [+2901 chars]",Android Central,https://www.androidcentral.com/phones/samsung-exynos-2600-chip-urgent-push-reported,In-house chip rumors continue to surface as Samsung looks to get back into form.
RELIANCE.NS,Energy,2025-03-10T14:12:58Z,"Europe’s reliance on US weapons has risen, SIPRI says",But markets believe the continent is about to experience a boost in domestic production as Russia’s threat looms.,"Europes imports of weapons made by the United States have skyrocketed in the past five years, raising serious questions about whether the continent can achieve its vaunted goal of defence autonomy.
… [+6060 chars]",Al Jazeera English,https://www.aljazeera.com/news/2025/3/10/europes-reliance-on-us-weapons-has-risen-says-sipri,But markets believe the continent is about to experience a boost in domestic production as Russia’s threat looms.
RELIANCE.NS,Energy,2025-03-06T20:35:00Z,AI Takes Center Stage on Deutsche Telekom's Perplexity Phone and I Tried It Out,"Announced at MWC in Barcelona this week, the phone is an example of what a more affordable device with advanced AI capabilities could look like.","With every passing tech launch it feels like generative AI is invading more and more devices, especially as companies position their AI features front and center as the primary reason we should consi… [+3115 chars]",CNET,https://www.cnet.com/tech/mobile/ai-takes-center-stage-on-deutsche-telekoms-perplexity-phone-and-i-tried-it-out/,"Announced at MWC in Barcelona this week, the phone is an example of what a more affordable device with advanced AI capabilities could look like."
RELIANCE.NS,Energy,2025-03-19T18:29:36Z,Vatican says Pope Francis no longer needs mechanical help to breathe,Pope Francis’s condition has continued to improve and he no longer needs to use noninvasive mechanical ventilation to help him breathe at night,"ROME -- Pope Franciss condition continued to improve Wednesday and he hasn't needed to use the noninvasive mechanical ventilation to help him breathe at night, the Vatican said.
The 88-year-old pont… [+999 chars]",ABC News,https://abcnews.go.com/International/wireStory/vatican-pope-francis-longer-mechanical-breathe-health-improves-119958031,Pope Francis’s condition has continued to improve and he no longer needs to use noninvasive mechanical ventilation to help him breathe at night
RELIANCE.NS,Energy,2025-03-13T08:37:52Z,Trump’s USAID freeze must serve as a wake-up call for Africa,"Africa's leaders must stop blaming Trump, address corruption, and end the continent's reliance on US aid.","On January 20, President Donald Trump sanctioned a 90-day halt on foreign aid, a decision that affected all financial support distributed by the United States Agency for International Development (US… [+8754 chars]",Al Jazeera English,https://www.aljazeera.com/opinions/2025/3/13/trumps-usaid-freeze-must-serve-as-a-wake-up-call-for-africa,"Africa's leaders must stop blaming Trump, address corruption, and end the continent's reliance on US aid."
RELIANCE.NS,Energy,2025-03-08T22:34:00Z,Axiom Space and Red Hat Will Bring Edge Computing to the International Space Station,"Axiom Space and Red Hat will collaborate to launch Data Center Unit-1 (AxDCU-1) to the International Space Station this spring. It's a small data processing prototype (powered by lightweight, edge-optimized Red Hat Device Edge) that will demonstrate initial O…","Axiom Space and Red Hat will collaborate to launch Data Center Unit-1 (AxDCU-1) to the International Space Station this spring. It's a small data processing prototype (powered by lightweight, edge-op… [+3305 chars]",Slashdot.org,https://linux.slashdot.org/story/25/03/08/205225/axiom-space-and-red-hat-will-bring-edge-computing-to-the-international-space-station,"Axiom Space and Red Hat will collaborate to launch Data Center Unit-1 (AxDCU-1) to the International Space Station this spring. It's a small data processing prototype (powered by lightweight, edge-optimized Red Hat Device Edge) that will demonstrate initial O…"
RELIANCE.NS,Energy,2025-03-18T20:16:04Z,Trump's chaos could spook the ad business,People who run businesses hate uncertainty. There's a lot of uncertainty right now.,"Donald Trump's new presidency is generating lots of economic question marks. That could slow ad spending.BRENDAN SMIALOWSKI/AFP via Getty Images
<ul><li>People who run businesses hate uncertainty. T… [+3279 chars]",Business Insider,https://www.businessinsider.com/trumps-chaos-could-spook-ad-business-spending-2025-3,People who run businesses hate uncertainty. There's a lot of uncertainty right now.
RELIANCE.NS,Energy,2025-03-04T04:12:53Z,Pfizer's CEO says he's got a plan to deal with Trump's tariffs — move overseas drug manufacturing to the US,"""I was expecting him probably to win. It was very big win,"" Pfizer's CEO Albert Bourla said of President Donald Trump's election victory.","""I was expecting him probably to win,"" Pfizer's CEO Albert Bourla said of President Donald Trump's election victory.Leigh Vogel via Getty Images; Carl Court via Getty Images
<ul><li>Pfizer's CEO sai… [+2625 chars]",Business Insider,https://www.businessinsider.com/pfizer-ceo-plan-trump-tariffs-move-manufacturing-back-us-2025-3,"""I was expecting him probably to win. It was very big win,"" Pfizer's CEO Albert Bourla said of President Donald Trump's election victory."
RELIANCE.NS,Energy,2025-03-05T09:30:00Z,Trump State Department nominee says private sector investment should replace foreign aid,A senior official poised to be the next US deputy secretary of state testified before lawmakers on Tuesday that Washington should shift US foreign engagement...,A senior official poised to be the next US deputy secretary of state testified before lawmakers on Tuesday that Washington should shift US foreign engagement away from traditional aid and toward priv… [+5907 chars],Yahoo Entertainment,https://www.yahoo.com/news/trump-state-department-nominee-says-093000984.html,A senior official poised to be the next US deputy secretary of state testified before lawmakers on Tuesday that Washington should shift US foreign engagement...
RELIANCE.NS,Energy,2025-03-22T17:28:46Z,"Pope Francis Will Be Released From the Hospital on Sunday, Doctors Say",Gemelli medical director Dr. Sergio Alfieri said Saturday that Francis will require at least two months of rest and rehabilitation.,"ROME Pope Francis will be released from the hospital on Sunday, after 38 days battling a life-threatening case of pneumonia in both lungs, his doctors said.
Gemelli medical director Dr. Sergio Alfie… [+2401 chars]",Time,https://time.com/7270785/pope-francis-hospital-release-doctors-announcement/,Gemelli medical director Dr. Sergio Alfieri said Saturday that Francis will require at least two months of rest and rehabilitation.
RELIANCE.NS,Energy,2025-03-04T04:00:47Z,Ron Wyden Presses FTC For Disclosure Rules On Ownership Rights Of Digital Purchases,"We talk a lot here about the concept of “ownership” of what we spend money on, particularly as it relates to purchases that are digital or have some reliance on internet connectivity. Despite being related, those two categories are actually quite distinct. On…","from the finally dept
We talk a lot here about the concept of “ownership” of what we spend money on, particularly as it relates to purchases that are digital or have some reliance on internet connec… [+3068 chars]",Techdirt,https://www.techdirt.com/2025/03/03/ron-wyden-presses-ftc-for-disclosure-rules-on-ownership-rights-of-digital-purchases/,"We talk a lot here about the concept of “ownership” of what we spend money on, particularly as it relates to purchases that are digital or have some reliance on internet connectivity. Despite being related, those two categories are actually quite distinct. On…"
RELIANCE.NS,Energy,2025-03-11T10:35:01Z,"Sources: Meta is testing its first in-house AI training chip, a key milestone as it moves to design more of its own silicon and reduce its reliance on Nvidia (Reuters)","Reuters:
Sources: Meta is testing its first in-house AI training chip, a key milestone as it moves to design more of its own silicon and reduce its reliance on Nvidia  —  Facebook owner Meta (META.O) is testing its first in-house chip for training artificial …","About This Page
This is a Techmeme archive page.
It shows how the site appeared at 6:35 AM ET, March 11, 2025.
The most current version of the site as always is available at our home page.
To vie… [+68 chars]",Techmeme.com,https://www.techmeme.com/250311/p11,"Reuters:
Sources: Meta is testing its first in-house AI training chip, a key milestone as it moves to design more of its own silicon and reduce its reliance on Nvidia  —  Facebook owner Meta (META.O) is testing its first in-house chip for training artificial …"
RELIANCE.NS,Energy,2025-03-25T10:41:40Z,Dismantling USAID Could Boost African Self-Reliance,"US President Donald Trump’s dismantling of America’s foreign-aid program may be the wake-up call African leaders need. If necessity is the mother of invention, the end of USAID could galvanize African governments to confront their countries’ challenges head-o…","US President Donald Trumps dismantling of Americas foreign-aid program may be the wake-up call African leaders need. If necessity is the mother of invention, the end of USAID could galvanize African … [+7505 chars]",Project Syndicate,https://www.project-syndicate.org/commentary/trump-cuts-usaid-opportunity-for-africa-to-become-self-reliant-by-hippolyte-fofack-2025-03,"US President Donald Trump’s dismantling of America’s foreign-aid program may be the wake-up call African leaders need. If necessity is the mother of invention, the end of USAID could galvanize African governments to confront their countries’ challenges head-o…"
RELIANCE.NS,Energy,2025-03-25T15:49:56Z,Apple's USB-C AirPods Max are getting the upgrade they should've had all along,The newest AirPods Max are only now gaining support for a feature that most of its competitors have had for a long while,"AirPods Max might be the most controversial pair of headphones on the planet. At $549, they are ridiculously expensive and feature controversial design decisions — like a heavy aluminum construction … [+4451 chars]",Android Central,https://www.androidcentral.com/accessories/headphones/apples-usb-c-airpods-max-are-getting-an-upgrade-it-shouldve-had-all-along,The newest AirPods Max are only now gaining support for a feature that most of its competitors have had for a long while
RELIANCE.NS,Energy,2025-03-05T08:15:00Z,China’s Leaders Aren’t Changing Course—No Matter How the World Changes Around Them,Beijing’s biggest annual political meeting is unlikely to make any big splashes. That could be a problem.,"On Jan. 1, Quishi, the official ideological journal of the Chinese Communist Party (CCP), published a speech by President Xi Jinping. In it, Chinas strongest leader since Mao Zedong called for a peri… [+7113 chars]",Time,https://time.com/7264683/china-national-peoples-congress-2025-li-work-report-xi-analysis/,Beijing’s biggest annual political meeting is unlikely to make any big splashes. That could be a problem.
RELIANCE.NS,Energy,2025-03-20T18:19:14Z,Europe is finally getting serious about commercial rockets,"Europe is on the cusp of a new dawn in commercial space technology. As global political tensions intensify and relationships with the US become increasingly strained, several European companies are now planning to conduct their own launches in an attempt to r…","I expect four or five companies to get to the point of launching, and then over a period of years reliability and launch cadence [or frequency] will determine which one or two of them survives, says … [+3728 chars]",MIT Technology Review,https://www.technologyreview.com/2025/03/20/1113582/europe-is-finally-getting-serious-about-commercial-rockets/,"Europe is on the cusp of a new dawn in commercial space technology. As global political tensions intensify and relationships with the US become increasingly strained, several European companies are now planning to conduct their own launches in an attempt to r…"
